{
  "id": "day-06",
  "index": 6,
  "briefing": {
    "title": "Day 6 — Disguised command-and-control",
    "body": "Malware hides its command-and-control (C2) traffic inside ordinary-looking connections. Two tools help: packets tagged with the disguised-c2 technique are denied, and an advisory signature (SIG-C2-BEACON) now matches known beacon patterns in the payload indicators — deny those too. Watch for sympathetic-looking traffic that is still malicious: the ruleset verdict does not change because of who is behind it.",
    "examples": [
      { "verdict": "DENY", "why": "Payload indicator matches advisory signature SIG-C2-BEACON (a known C2 beacon)." }
    ],
    "introducesConcepts": ["disguised-c2", "signatureId-rule"]
  },
  "ruleset": {
    "defaultVerdict": "ALLOW",
    "geoMap": { "185.220.100.0/24": "XX" },
    "rules": [
      { "id": "r-block-telnet", "description": "Deny inbound Telnet (TCP/23).", "priority": 100,
        "match": { "protocol": "TCP", "dstPort": 23 }, "verdict": "DENY", "isException": false,
        "source": { "kind": "RFC", "ref": "RFC 854 (Telnet)", "shownToPlayer": true } },
      { "id": "r-block-smb", "description": "Deny inbound SMB (TCP/445).", "priority": 100,
        "match": { "protocol": "TCP", "dstPort": 445 }, "verdict": "DENY", "isException": false, "source": null },
      { "id": "r-block-rdp", "description": "Deny inbound RDP (TCP/3389) per CVE advisory.", "priority": 100,
        "match": { "protocol": "TCP", "dstPort": 3389 }, "verdict": "DENY", "isException": false,
        "source": { "kind": "CVE", "ref": "CVE-2019-0708 (BlueKeep, illustrative)", "shownToPlayer": true } },
      { "id": "r-block-spoof", "description": "Deny spoofed-source packets.", "priority": 120,
        "match": { "technique": "spoofed-source" }, "verdict": "DENY", "isException": false,
        "source": { "kind": "TECHNIQUE", "ref": "MITRE ATT&CK T1036 (Masquerading)", "shownToPlayer": true } },
      { "id": "r-block-frag", "description": "Deny fragmented malicious payloads.", "priority": 120,
        "match": { "technique": "fragmented-payload" }, "verdict": "DENY", "isException": false,
        "source": { "kind": "TECHNIQUE", "ref": "MITRE ATT&CK T1027 (Obfuscated/Fragmented)", "shownToPlayer": true } },
      { "id": "r-block-c2", "description": "Deny disguised command-and-control (C2) traffic.", "priority": 120,
        "match": { "technique": "disguised-c2" }, "verdict": "DENY", "isException": false,
        "source": { "kind": "TECHNIQUE", "ref": "MITRE ATT&CK T1071 (Application Layer Protocol / C2)", "shownToPlayer": true } },
      { "id": "r-block-sig", "description": "Deny payloads matching advisory signature SIG-C2-BEACON.", "priority": 110,
        "match": { "signatureId": "SIG-C2-BEACON" }, "verdict": "DENY", "isException": false,
        "source": { "kind": "TECHNIQUE", "ref": "MITRE ATT&CK T1071 (Application Layer Protocol / C2)", "shownToPlayer": true } },
      { "id": "r-block-badnet", "description": "Deny all traffic from the known-bad subnet 203.0.113.0/24.", "priority": 90,
        "match": { "srcCidr": "203.0.113.0/24" }, "verdict": "DENY", "isException": false, "source": null },
      { "id": "r-block-db", "description": "Deny the database port (TCP/3306) from the internet.", "priority": 80,
        "match": { "protocol": "TCP", "dstPort": 3306 }, "verdict": "DENY", "isException": false, "source": null },
      { "id": "r-geo-block", "description": "Deny sources in the geo-blocked region XX.", "priority": 70,
        "match": { "geo": "XX" }, "verdict": "DENY", "isException": false, "source": null },
      { "id": "r-finance-db-allow", "description": "Exception: allow TCP/3306 from the finance VPN (10.20.0.0/16).", "priority": 180,
        "match": { "srcCidr": "10.20.0.0/16", "dstPort": 3306 }, "verdict": "ALLOW", "isException": true, "source": null }
    ]
  },
  "clockSeconds": 210,
  "passThreshold": { "minAccuracy": 0.8, "maxSecurityIncidents": 1, "minMorale": 60 },
  "queue": [
    { "id": "d06-p01", "srcAddress": "198.51.100.10", "dstAddress": "10.0.0.5", "srcPort": 51500, "dstPort": 443,
      "protocol": "TCP", "flags": ["SYN"], "payloadIndicators": [{ "label": "TLS SNI", "value": "updates.example.com", "signatureId": null }],
      "rawPayload": null, "techniques": [], "groundTruth": "benign", "expectedSource": "198.51.100.10", "fragmentGroup": null, "narrative": null, "source": null },
    { "id": "d06-p02", "srcAddress": "198.51.100.66", "dstAddress": "10.0.0.40", "srcPort": 40222, "dstPort": 443,
      "protocol": "TCP", "flags": ["PSH", "ACK"], "payloadIndicators": [{ "label": "TLS SNI", "value": "cdn.example.net", "signatureId": null }, { "label": "Beacon interval", "value": "60s fixed", "signatureId": "SIG-C2-BEACON" }],
      "rawPayload": null, "techniques": ["disguised-c2"], "groundTruth": "malicious", "expectedSource": null, "fragmentGroup": null, "narrative": null,
      "source": { "kind": "TECHNIQUE", "ref": "MITRE ATT&CK T1071 (Application Layer Protocol / C2)", "shownToPlayer": false } },
    { "id": "d06-p03", "srcAddress": "192.0.2.120", "dstAddress": "10.0.0.41", "srcPort": 40777, "dstPort": 8443,
      "protocol": "TCP", "flags": ["PSH", "ACK"], "payloadIndicators": [{ "label": "Pattern", "value": "periodic small POSTs", "signatureId": "SIG-C2-BEACON" }],
      "rawPayload": null, "techniques": [], "groundTruth": "malicious", "expectedSource": null, "fragmentGroup": null, "narrative": null,
      "source": { "kind": "TECHNIQUE", "ref": "MITRE ATT&CK T1071 (Application Layer Protocol / C2)", "shownToPlayer": false } },
    { "id": "d06-p04", "srcAddress": "10.0.0.55", "dstAddress": "203.0.113.9", "srcPort": 51020, "dstPort": 443,
      "protocol": "TCP", "flags": ["PSH", "ACK"], "payloadIndicators": [{ "label": "Pattern", "value": "steady exfil to unknown host", "signatureId": "SIG-C2-BEACON" }],
      "rawPayload": null, "techniques": ["disguised-c2"], "groundTruth": "malicious", "expectedSource": null, "fragmentGroup": null,
      "narrative": { "id": "n-hr", "framing": "This host belongs to an employee currently under an HR investigation. It is still exfiltrating data to an unknown host.", "correctVerdictUnchanged": true },
      "source": { "kind": "TECHNIQUE", "ref": "MITRE ATT&CK T1071 (Application Layer Protocol / C2)", "shownToPlayer": false } },
    { "id": "d06-p05", "srcAddress": "198.51.100.60", "dstAddress": "10.0.0.80", "srcPort": 40010, "dstPort": 80,
      "protocol": "TCP", "flags": ["SYN"], "payloadIndicators": [{ "label": "Service", "value": "HTTP", "signatureId": null }],
      "rawPayload": null, "techniques": [], "groundTruth": "benign", "expectedSource": "198.51.100.60", "fragmentGroup": null, "narrative": null, "source": null },
    { "id": "d06-p06", "srcAddress": "203.0.113.140", "dstAddress": "10.0.0.5", "srcPort": 41777, "dstPort": 443,
      "protocol": "TCP", "flags": ["SYN"], "payloadIndicators": [{ "label": "Service", "value": "HTTPS", "signatureId": null }],
      "rawPayload": null, "techniques": [], "groundTruth": "malicious", "expectedSource": null, "fragmentGroup": null, "narrative": null, "source": null },
    { "id": "d06-p07", "srcAddress": "10.20.5.5", "dstAddress": "10.0.0.30", "srcPort": 52777, "dstPort": 3306,
      "protocol": "TCP", "flags": ["SYN"], "payloadIndicators": [{ "label": "Service", "value": "MySQL", "signatureId": null }],
      "rawPayload": null, "techniques": [], "groundTruth": "benign", "expectedSource": "10.20.5.5", "fragmentGroup": null, "narrative": null, "source": null },
    { "id": "d06-p08", "srcAddress": "198.51.100.150", "dstAddress": "10.0.0.22", "srcPort": 52001, "dstPort": 22,
      "protocol": "TCP", "flags": ["SYN"], "payloadIndicators": [{ "label": "Service", "value": "SSH", "signatureId": null }],
      "rawPayload": null, "techniques": [], "groundTruth": "benign", "expectedSource": "198.51.100.150", "fragmentGroup": null, "narrative": null, "source": null },
    { "id": "d06-p09", "srcAddress": "185.220.100.50", "dstAddress": "10.0.0.5", "srcPort": 44777, "dstPort": 443,
      "protocol": "TCP", "flags": ["SYN"], "payloadIndicators": [{ "label": "Service", "value": "HTTPS", "signatureId": null }],
      "rawPayload": null, "techniques": [], "groundTruth": "malicious", "expectedSource": null, "fragmentGroup": null, "narrative": null, "source": null },
    { "id": "d06-p10", "srcAddress": "198.51.100.222", "dstAddress": "10.0.0.5", "srcPort": 34980, "dstPort": 443,
      "protocol": "TCP", "flags": ["SYN", "ACK"], "payloadIndicators": [{ "label": "TLS SNI", "value": "api.partner.example", "signatureId": null }],
      "rawPayload": null, "techniques": [], "groundTruth": "benign", "expectedSource": "198.51.100.222", "fragmentGroup": null, "narrative": null, "source": null }
  ],
  "introducesConcepts": ["disguised-c2", "signatureId-rule"]
}
