{
  "id": "day-05",
  "index": 5,
  "briefing": {
    "title": "Day 5 — Fragmented payloads",
    "body": "Attackers split a malicious payload across multiple fragments to slip past simple inspection. The deep inspector now shows a 'fragment group' — packets tagged as part of a fragmented payload are reassembled and denied. If the inspector shows a fragment-group flag, deny it. A per-shift clock is available in Settings from today if you want more pressure; it is generous.",
    "examples": [
      { "verdict": "DENY", "why": "The inspector shows this packet belongs to a fragmented-payload group." }
    ],
    "introducesConcepts": ["fragmented-payload"]
  },
  "ruleset": {
    "defaultVerdict": "ALLOW",
    "geoMap": { "185.220.100.0/24": "XX" },
    "rules": [
      { "id": "r-block-telnet", "description": "Deny inbound Telnet (TCP/23).", "priority": 100,
        "match": { "protocol": "TCP", "dstPort": 23 }, "verdict": "DENY", "isException": false,
        "source": { "kind": "RFC", "ref": "RFC 854 (Telnet)", "shownToPlayer": true } },
      { "id": "r-block-smb", "description": "Deny inbound SMB (TCP/445).", "priority": 100,
        "match": { "protocol": "TCP", "dstPort": 445 }, "verdict": "DENY", "isException": false, "source": null },
      { "id": "r-block-rdp", "description": "Deny inbound RDP (TCP/3389) per CVE advisory.", "priority": 100,
        "match": { "protocol": "TCP", "dstPort": 3389 }, "verdict": "DENY", "isException": false,
        "source": { "kind": "CVE", "ref": "CVE-2019-0708 (BlueKeep, illustrative)", "shownToPlayer": true } },
      { "id": "r-block-spoof", "description": "Deny spoofed-source packets.", "priority": 120,
        "match": { "technique": "spoofed-source" }, "verdict": "DENY", "isException": false,
        "source": { "kind": "TECHNIQUE", "ref": "MITRE ATT&CK T1036 (Masquerading)", "shownToPlayer": true } },
      { "id": "r-block-frag", "description": "Deny packets that are part of a fragmented malicious payload.", "priority": 120,
        "match": { "technique": "fragmented-payload" }, "verdict": "DENY", "isException": false,
        "source": { "kind": "TECHNIQUE", "ref": "MITRE ATT&CK T1027 (Obfuscated/Fragmented)", "shownToPlayer": true } },
      { "id": "r-block-badnet", "description": "Deny all traffic from the known-bad subnet 203.0.113.0/24.", "priority": 90,
        "match": { "srcCidr": "203.0.113.0/24" }, "verdict": "DENY", "isException": false, "source": null },
      { "id": "r-block-db", "description": "Deny the database port (TCP/3306) from the internet.", "priority": 80,
        "match": { "protocol": "TCP", "dstPort": 3306 }, "verdict": "DENY", "isException": false, "source": null },
      { "id": "r-geo-block", "description": "Deny sources in the geo-blocked region XX.", "priority": 70,
        "match": { "geo": "XX" }, "verdict": "DENY", "isException": false, "source": null },
      { "id": "r-finance-db-allow", "description": "Exception: allow TCP/3306 from the finance VPN (10.20.0.0/16).", "priority": 180,
        "match": { "srcCidr": "10.20.0.0/16", "dstPort": 3306 }, "verdict": "ALLOW", "isException": true, "source": null }
    ]
  },
  "clockSeconds": 240,
  "passThreshold": { "minAccuracy": 0.75, "maxSecurityIncidents": 2, "minMorale": 50 },
  "queue": [
    { "id": "d05-p01", "srcAddress": "198.51.100.10", "dstAddress": "10.0.0.5", "srcPort": 51500, "dstPort": 443,
      "protocol": "TCP", "flags": ["SYN"], "payloadIndicators": [{ "label": "Service", "value": "HTTPS", "signatureId": null }],
      "rawPayload": null, "techniques": [], "groundTruth": "benign", "expectedSource": "198.51.100.10", "fragmentGroup": null, "narrative": null, "source": null },
    { "id": "d05-p02", "srcAddress": "192.0.2.40", "dstAddress": "10.0.0.5", "srcPort": 40222, "dstPort": 443,
      "protocol": "TCP", "flags": ["PSH", "ACK"], "payloadIndicators": [{ "label": "Fragment", "value": "1 of 3", "signatureId": null }],
      "rawPayload": "GET /..%2f..%2f [fragmented]", "techniques": ["fragmented-payload"], "groundTruth": "malicious", "expectedSource": null, "fragmentGroup": "frag-A", "narrative": null,
      "source": { "kind": "TECHNIQUE", "ref": "MITRE ATT&CK T1027 (Obfuscated/Fragmented)", "shownToPlayer": false } },
    { "id": "d05-p03", "srcAddress": "192.0.2.40", "dstAddress": "10.0.0.5", "srcPort": 40223, "dstPort": 443,
      "protocol": "TCP", "flags": ["PSH", "ACK"], "payloadIndicators": [{ "label": "Fragment", "value": "2 of 3", "signatureId": null }],
      "rawPayload": "etc%2fpasswd [fragmented]", "techniques": ["fragmented-payload"], "groundTruth": "malicious", "expectedSource": null, "fragmentGroup": "frag-A", "narrative": null,
      "source": { "kind": "TECHNIQUE", "ref": "MITRE ATT&CK T1027 (Obfuscated/Fragmented)", "shownToPlayer": false } },
    { "id": "d05-p04", "srcAddress": "198.51.100.60", "dstAddress": "10.0.0.80", "srcPort": 40010, "dstPort": 80,
      "protocol": "TCP", "flags": ["SYN"], "payloadIndicators": [{ "label": "Service", "value": "HTTP", "signatureId": null }],
      "rawPayload": null, "techniques": [], "groundTruth": "benign", "expectedSource": "198.51.100.60", "fragmentGroup": null, "narrative": null, "source": null },
    { "id": "d05-p05", "srcAddress": "185.220.100.22", "dstAddress": "10.0.0.5", "srcPort": 44100, "dstPort": 443,
      "protocol": "TCP", "flags": ["SYN"], "payloadIndicators": [{ "label": "Service", "value": "HTTPS", "signatureId": null }],
      "rawPayload": null, "techniques": [], "groundTruth": "malicious", "expectedSource": null, "fragmentGroup": null, "narrative": null, "source": null },
    { "id": "d05-p06", "srcAddress": "192.0.2.41", "dstAddress": "10.0.0.9", "srcPort": 40333, "dstPort": 8080,
      "protocol": "TCP", "flags": ["PSH", "ACK"], "payloadIndicators": [{ "label": "Fragment", "value": "1 of 2", "signatureId": null }],
      "rawPayload": null, "techniques": ["fragmented-payload"], "groundTruth": "malicious", "expectedSource": null, "fragmentGroup": "frag-B", "narrative": null,
      "source": { "kind": "TECHNIQUE", "ref": "MITRE ATT&CK T1027 (Obfuscated/Fragmented)", "shownToPlayer": false } },
    { "id": "d05-p07", "srcAddress": "198.51.100.150", "dstAddress": "10.0.0.22", "srcPort": 52001, "dstPort": 22,
      "protocol": "TCP", "flags": ["SYN"], "payloadIndicators": [{ "label": "Service", "value": "SSH", "signatureId": null }],
      "rawPayload": null, "techniques": [], "groundTruth": "benign", "expectedSource": "198.51.100.150", "fragmentGroup": null, "narrative": null, "source": null },
    { "id": "d05-p08", "srcAddress": "10.20.5.5", "dstAddress": "10.0.0.30", "srcPort": 52777, "dstPort": 3306,
      "protocol": "TCP", "flags": ["SYN"], "payloadIndicators": [{ "label": "Service", "value": "MySQL", "signatureId": null }],
      "rawPayload": null, "techniques": [], "groundTruth": "benign", "expectedSource": "10.20.5.5", "fragmentGroup": null, "narrative": null, "source": null },
    { "id": "d05-p09", "srcAddress": "203.0.113.30", "dstAddress": "10.0.0.5", "srcPort": 41777, "dstPort": 443,
      "protocol": "TCP", "flags": ["SYN"], "payloadIndicators": [{ "label": "Service", "value": "HTTPS", "signatureId": null }],
      "rawPayload": null, "techniques": [], "groundTruth": "malicious", "expectedSource": null, "fragmentGroup": null, "narrative": null, "source": null },
    { "id": "d05-p10", "srcAddress": "198.51.100.200", "dstAddress": "10.0.0.53", "srcPort": 33777, "dstPort": 53,
      "protocol": "UDP", "flags": [], "payloadIndicators": [{ "label": "Service", "value": "DNS query", "signatureId": null }],
      "rawPayload": null, "techniques": [], "groundTruth": "benign", "expectedSource": "198.51.100.200", "fragmentGroup": null, "narrative": null, "source": null }
  ],
  "introducesConcepts": ["fragmented-payload"]
}
