{
  "id": "day-07",
  "index": 7,
  "briefing": {
    "title": "Day 7 — Reading TCP flags",
    "body": "Some scans and attacks are revealed by unusual TCP flag combinations. A 'Xmas scan' sets the FIN, URG and PSH flags together — a pattern no normal connection uses. Deny any TCP packet carrying all three flags. Normal traffic (a plain SYN, or SYN+ACK) is unaffected. All earlier rules remain in force.",
    "examples": [
      { "verdict": "DENY", "why": "TCP flags FIN+URG+PSH set together is a Xmas-scan probe." },
      { "verdict": "ALLOW", "why": "A normal SYN handshake to an allowed port." }
    ],
    "introducesConcepts": ["flags-rule"]
  },
  "ruleset": {
    "defaultVerdict": "ALLOW",
    "geoMap": { "185.220.100.0/24": "XX" },
    "rules": [
      { "id": "r-block-telnet", "description": "Deny inbound Telnet (TCP/23).", "priority": 100,
        "match": { "protocol": "TCP", "dstPort": 23 }, "verdict": "DENY", "isException": false,
        "source": { "kind": "RFC", "ref": "RFC 854 (Telnet)", "shownToPlayer": true } },
      { "id": "r-block-smb", "description": "Deny inbound SMB (TCP/445).", "priority": 100,
        "match": { "protocol": "TCP", "dstPort": 445 }, "verdict": "DENY", "isException": false, "source": null },
      { "id": "r-block-rdp", "description": "Deny inbound RDP (TCP/3389) per CVE advisory.", "priority": 100,
        "match": { "protocol": "TCP", "dstPort": 3389 }, "verdict": "DENY", "isException": false,
        "source": { "kind": "CVE", "ref": "CVE-2019-0708 (BlueKeep, illustrative)", "shownToPlayer": true } },
      { "id": "r-block-xmas", "description": "Deny Xmas-scan probes (TCP flags FIN+URG+PSH set together).", "priority": 95,
        "match": { "protocol": "TCP", "flags": ["FIN", "URG", "PSH"] }, "verdict": "DENY", "isException": false,
        "source": { "kind": "RFC", "ref": "RFC 793 (TCP flags)", "shownToPlayer": true } },
      { "id": "r-block-spoof", "description": "Deny spoofed-source packets.", "priority": 120,
        "match": { "technique": "spoofed-source" }, "verdict": "DENY", "isException": false,
        "source": { "kind": "TECHNIQUE", "ref": "MITRE ATT&CK T1036 (Masquerading)", "shownToPlayer": true } },
      { "id": "r-block-frag", "description": "Deny fragmented malicious payloads.", "priority": 120,
        "match": { "technique": "fragmented-payload" }, "verdict": "DENY", "isException": false,
        "source": { "kind": "TECHNIQUE", "ref": "MITRE ATT&CK T1027 (Obfuscated/Fragmented)", "shownToPlayer": true } },
      { "id": "r-block-c2", "description": "Deny disguised command-and-control (C2) traffic.", "priority": 120,
        "match": { "technique": "disguised-c2" }, "verdict": "DENY", "isException": false,
        "source": { "kind": "TECHNIQUE", "ref": "MITRE ATT&CK T1071 (Application Layer Protocol / C2)", "shownToPlayer": true } },
      { "id": "r-block-sig", "description": "Deny payloads matching advisory signature SIG-C2-BEACON.", "priority": 110,
        "match": { "signatureId": "SIG-C2-BEACON" }, "verdict": "DENY", "isException": false,
        "source": { "kind": "TECHNIQUE", "ref": "MITRE ATT&CK T1071 (Application Layer Protocol / C2)", "shownToPlayer": true } },
      { "id": "r-block-badnet", "description": "Deny all traffic from the known-bad subnet 203.0.113.0/24.", "priority": 90,
        "match": { "srcCidr": "203.0.113.0/24" }, "verdict": "DENY", "isException": false, "source": null },
      { "id": "r-block-db", "description": "Deny the database port (TCP/3306) from the internet.", "priority": 80,
        "match": { "protocol": "TCP", "dstPort": 3306 }, "verdict": "DENY", "isException": false, "source": null },
      { "id": "r-geo-block", "description": "Deny sources in the geo-blocked region XX.", "priority": 70,
        "match": { "geo": "XX" }, "verdict": "DENY", "isException": false, "source": null },
      { "id": "r-finance-db-allow", "description": "Exception: allow TCP/3306 from the finance VPN (10.20.0.0/16).", "priority": 180,
        "match": { "srcCidr": "10.20.0.0/16", "dstPort": 3306 }, "verdict": "ALLOW", "isException": true, "source": null }
    ]
  },
  "clockSeconds": 180,
  "passThreshold": { "minAccuracy": 0.8, "maxSecurityIncidents": 1, "minMorale": 60 },
  "queue": [
    { "id": "d07-p01", "srcAddress": "198.51.100.10", "dstAddress": "10.0.0.5", "srcPort": 51500, "dstPort": 443,
      "protocol": "TCP", "flags": ["SYN"], "payloadIndicators": [{ "label": "Service", "value": "HTTPS", "signatureId": null }],
      "rawPayload": null, "techniques": [], "groundTruth": "benign", "expectedSource": "198.51.100.10", "fragmentGroup": null, "narrative": null, "source": null },
    { "id": "d07-p02", "srcAddress": "192.0.2.60", "dstAddress": "10.0.0.5", "srcPort": 40222, "dstPort": 443,
      "protocol": "TCP", "flags": ["FIN", "URG", "PSH"], "payloadIndicators": [{ "label": "Scan", "value": "flags FIN/URG/PSH", "signatureId": null }],
      "rawPayload": null, "techniques": [], "groundTruth": "malicious", "expectedSource": null, "fragmentGroup": null, "narrative": null,
      "source": { "kind": "RFC", "ref": "RFC 793 (TCP flags)", "shownToPlayer": false } },
    { "id": "d07-p03", "srcAddress": "198.51.100.66", "dstAddress": "10.0.0.80", "srcPort": 40010, "dstPort": 80,
      "protocol": "TCP", "flags": ["SYN", "ACK"], "payloadIndicators": [{ "label": "Service", "value": "HTTP", "signatureId": null }],
      "rawPayload": null, "techniques": [], "groundTruth": "benign", "expectedSource": "198.51.100.66", "fragmentGroup": null, "narrative": null, "source": null },
    { "id": "d07-p04", "srcAddress": "192.0.2.61", "dstAddress": "10.0.0.9", "srcPort": 40333, "dstPort": 8080,
      "protocol": "TCP", "flags": ["FIN", "URG", "PSH"], "payloadIndicators": [{ "label": "Scan", "value": "flags FIN/URG/PSH", "signatureId": null }],
      "rawPayload": null, "techniques": [], "groundTruth": "malicious", "expectedSource": null, "fragmentGroup": null, "narrative": null,
      "source": { "kind": "RFC", "ref": "RFC 793 (TCP flags)", "shownToPlayer": false } },
    { "id": "d07-p05", "srcAddress": "10.0.0.30", "dstAddress": "10.0.0.5", "srcPort": 41999, "dstPort": 443,
      "protocol": "TCP", "flags": ["SYN"], "payloadIndicators": [{ "label": "Service", "value": "HTTPS", "signatureId": null }],
      "rawPayload": null, "techniques": ["spoofed-source"], "groundTruth": "malicious", "expectedSource": "198.51.100.9", "fragmentGroup": null, "narrative": null,
      "source": { "kind": "TECHNIQUE", "ref": "MITRE ATT&CK T1036 (Masquerading)", "shownToPlayer": false } },
    { "id": "d07-p06", "srcAddress": "198.51.100.150", "dstAddress": "10.0.0.22", "srcPort": 52001, "dstPort": 22,
      "protocol": "TCP", "flags": ["SYN"], "payloadIndicators": [{ "label": "Service", "value": "SSH", "signatureId": null }],
      "rawPayload": null, "techniques": [], "groundTruth": "benign", "expectedSource": "198.51.100.150", "fragmentGroup": null, "narrative": null, "source": null },
    { "id": "d07-p07", "srcAddress": "203.0.113.70", "dstAddress": "10.0.0.5", "srcPort": 41777, "dstPort": 443,
      "protocol": "TCP", "flags": ["SYN"], "payloadIndicators": [{ "label": "Service", "value": "HTTPS", "signatureId": null }],
      "rawPayload": null, "techniques": [], "groundTruth": "malicious", "expectedSource": null, "fragmentGroup": null, "narrative": null, "source": null },
    { "id": "d07-p08", "srcAddress": "10.20.5.5", "dstAddress": "10.0.0.30", "srcPort": 52777, "dstPort": 3306,
      "protocol": "TCP", "flags": ["SYN"], "payloadIndicators": [{ "label": "Service", "value": "MySQL", "signatureId": null }],
      "rawPayload": null, "techniques": [], "groundTruth": "benign", "expectedSource": "10.20.5.5", "fragmentGroup": null, "narrative": null, "source": null },
    { "id": "d07-p09", "srcAddress": "192.0.2.62", "dstAddress": "10.0.0.5", "srcPort": 40555, "dstPort": 3389,
      "protocol": "TCP", "flags": ["SYN"], "payloadIndicators": [{ "label": "Service", "value": "RDP", "signatureId": null }],
      "rawPayload": null, "techniques": [], "groundTruth": "policy-violating", "expectedSource": null, "fragmentGroup": null, "narrative": null,
      "source": { "kind": "CVE", "ref": "CVE-2019-0708 (BlueKeep, illustrative)", "shownToPlayer": false } },
    { "id": "d07-p10", "srcAddress": "198.51.100.200", "dstAddress": "10.0.0.53", "srcPort": 33777, "dstPort": 53,
      "protocol": "UDP", "flags": [], "payloadIndicators": [{ "label": "Service", "value": "DNS query", "signatureId": null }],
      "rawPayload": null, "techniques": [], "groundTruth": "benign", "expectedSource": "198.51.100.200", "fragmentGroup": null, "narrative": null, "source": null }
  ],
  "introducesConcepts": ["flags-rule"]
}
